{
  "name": "incursa/workbench metadata catalog",
  "version": 6,
  "artifact_id_format": {
    "summary": "PREFIX-DOMAIN(-GROUPING...)",
    "grouping_segments": {
      "minimum": 0,
      "maximum": null,
      "segment_pattern": "^[A-Z][A-Z0-9]*$",
      "segment_must_start_with_letter": true
    },
    "sequence": {
      "minimum_digits": 4,
      "pattern": "^\\d{4,}$"
    }
  },
  "requirement_id_format": {
    "summary": "REQ-DOMAIN(-GROUPING...)-SEQUENCE",
    "grouping_segments": {
      "minimum": 0,
      "maximum": null,
      "segment_pattern": "^[A-Z][A-Z0-9]*$",
      "segment_must_start_with_letter": true
    },
    "sequence": {
      "minimum_digits": 4,
      "pattern": "^\\d{4,}$"
    }
  },
  "sequence": {
    "minimum_digits": 4,
    "pattern": "^\\d{4,}$"
  },
  "segments": {
    "domain": {
      "pattern": "^[A-Z][A-Z0-9]*$"
    },
    "grouping": {
      "pattern": "^[A-Z][A-Z0-9]*$",
      "allow_multiple": true
    }
  },
  "artifact_id_templates": {
    "specification": "SPEC-{domain}{grouping}",
    "architecture": "ARC-{domain}{grouping}-{sequence}",
    "work_item": "WI-{domain}{grouping}-{sequence}",
    "verification": "VER-{domain}{grouping}-{sequence}"
  },
  "requirement_id_template": "REQ-{domain}{grouping}-{sequence}",
  "grouping_key_registry": [
    {
      "code": "STD",
      "name": "Standard",
      "description": "Core definitions, traceability model, and publication rules"
    },
    {
      "code": "ID",
      "name": "Identifier Policy",
      "description": "Identifier rules and grouping-key metadata"
    },
    {
      "code": "LAY",
      "name": "Layout",
      "description": "Repository layout and artifact placement"
    },
    {
      "code": "PRF",
      "name": "Profiles",
      "description": "Conformance profiles and enforcement levels"
    },
    {
      "code": "TPL",
      "name": "Templates",
      "description": "Document templates and compact requirement grammar"
    },
    {
      "code": "SCH",
      "name": "Schemas",
      "description": "Schema and validation rules"
    },
    {
      "code": "EXM",
      "name": "Examples",
      "description": "Worked examples and traceability coverage"
    }
  ],
  "notes": [
    "specification identifiers use the SPEC-{domain}{grouping} template and stop after the optional grouping segments",
    "architecture, work-item, and verification identifiers continue to use terminal sequences",
    "grouping expands to zero or more '-SEGMENT' tokens after the domain token",
    "grouping segments must start with a letter, so numeric-only grouping values are invalid",
    "the terminal sequence is zero-padded to at least four digits",
    "domain and grouping segments use the same uppercase alphanumeric token pattern",
    "the reference package allows zero or more grouping segments and does not set a hard maximum",
    "grouping-key registry entries provide the human-readable names and descriptions for the abbreviated codes used in the spec suite",
    "requirement identifiers use the same domain and grouping rules as specification identifiers but use the REQ prefix and terminal sequence because they identify clauses within specifications",
    "tests and code may reference requirement identifiers directly"
  ]
}
